{"claim_tier":"T3/NOVEL/EXPLORATORY/FALSIFIABLE","cliffs_delta":0.2600260162601626,"collector_sha256":"1c7cd741e06372d30e01ba4ae7220de1103e9bfa2f9a1f475c012a4012a80026","config_hash":"7719b4f26fa3a49e8d92e7060a6ba8ad14f31e2f235044c2ddf6c94cf6e6722a","config_sha256":"7719b4f26fa3a49e8d92e7060a6ba8ad14f31e2f235044c2ddf6c94cf6e6722a","data_sha256":"2e648fdfd49a05db8858d6202d884b9d227941e38737e10e8aedbf4406d080c8","dirty_git":false,"effect_size_class":"small","falsification_status":"HYPOTHESIS_NOT_SUPPORTED","forbidden_claims_absent":true,"git_sha":"6af9c1675c0f2f36a4888dfa01749a8fbfa63e16","kernel_version":"ricci_kernel.v2-weighted-sizemeasure","license_status":"PUBLIC_NO_LICENSE","mean_curvature":-0.14166937019753975,"n_surrogates":1000,"null_mean":-0.18732062445231995,"null_model_type":"iaaft","null_std":0.011503063580344404,"observed_count":615,"p_value":1.0,"replay_command":"geosync-research run --line ricci_microstructure_v1 --config configs/research/ricci_microstructure_v1.json --data data/processed/ricci_microstructure_v1/validated_l2_frame.parquet --out artifacts/runs/ricci_microstructure_v1 --seed 1337","run_id":"ricci_microstructure_v1_7719b4f2_ce6552c3_1337","schema_version":"ricci_microstructure_artifact.v1","seed":1337,"source":"BINANCE_FUTURES_DEPTH","source_class":"BINANCE_PUBLIC_DEPTH","timestamp_utc":"2026-06-24T08:07:59Z"}
